{
  "schemaVersion": 1,
  "applicationVersion": "0.7.0-dev",
  "command": "inspect",
  "status": "completed",
  "result": { "type": "manifest", "ready": true },
  "warnings": [],
  "error": null,
  "startedAt": "2026-07-23T12:00:00.000Z",
  "completedAt": "2026-07-23T12:00:00.010Z",
  "durationMs": 10
}
